{
  "projection_type": "site_links",
  "generated_at": "2026-01-31T11:49:54.914Z",
  "source_version": {
    "lab_commit_sha": "dev",
    "curated_index_version": "2.0.0"
  },
  "data": {
    "version": "2.0.0",
    "cross_site_links": [
      {
        "source_page": "/runs",
        "target_site": "docs",
        "target_path": "/docs/evaluation",
        "rationale": "Link to evaluation and Validation Lab reference entry surfaces",
        "rel_type": "related",
        "link_text": "Evaluation & Governance"
      },
      {
        "source_page": "/runs/[run_id]",
        "target_site": "docs",
        "target_path": "/docs/evaluation/validation-lab/evidence-pack-contract",
        "rationale": "Link to Lab-side evidence-pack contract reference",
        "rel_type": "related",
        "link_text": "Evidence Pack Contract Reference"
      },
      {
        "source_page": "/rulesets",
        "target_site": "docs",
        "target_path": "/docs/evaluation/validation-lab/rulesets",
        "rationale": "Link to Validation Lab ruleset reference documentation",
        "rel_type": "related",
        "link_text": "Ruleset Reference"
      },
      {
        "source_page": "/policies/fmm",
        "target_site": "docs",
        "target_path": "/docs/evaluation/validation-lab",
        "rationale": "Link to the bounded Validation Lab reference entry in docs",
        "rel_type": "related",
        "link_text": "Validation Lab Reference"
      },
      {
        "source_page": "/policies/contract",
        "target_site": "docs",
        "target_path": "/docs/evaluation/validation-lab/evidence-pack-contract",
        "rationale": "Link to Lab-side evidence-pack contract reference",
        "rel_type": "related",
        "link_text": "Evidence Pack Contract Reference"
      },
      {
        "source_page": "/",
        "target_site": "website",
        "target_path": "/",
        "rationale": "Link to main MPLP site",
        "rel_type": "home",
        "link_text": "MPLP Home"
      },
      {
        "source_page": "/coverage",
        "target_site": "website",
        "target_path": "/governance/protocol",
        "rationale": "Link to protocol governance context",
        "rel_type": "related",
        "link_text": "Protocol Governance"
      }
    ],
    "expected_backlinks": {
      "from_website": [
        {
          "source_path": "/tools",
          "expected_target": "/runs",
          "rationale": "Website should link to Lab runs from tools page"
        }
      ],
      "from_docs": [
        {
          "source_path": "/docs/evaluation",
          "expected_target": "/runs",
          "rationale": "Docs evaluation entry should link to Lab runs as downstream examples"
        },
        {
          "source_path": "/docs/evaluation/validation-lab/evidence-pack-contract",
          "expected_target": "/runs",
          "rationale": "Evidence-pack reference should link to Lab runs as examples"
        }
      ]
    },
    "rules": [
      {
        "name": "No hardcoded cross-site URLs",
        "description": "All cross-site links must use hosts.ts + this linkmap",
        "enforcement_gate": "GATE-V2-CROSSLINK-SSOT-01"
      },
      {
        "name": "No localhost references",
        "description": "No localhost or preview domain links allowed",
        "enforcement_gate": "GATE-V2-HOST-ALLOW-01"
      },
      {
        "name": "Canonical host enforcement",
        "description": "All canonical URLs must use CANONICAL_HOST from hosts.ts",
        "enforcement_gate": "GATE-V2-CANONICAL-01"
      }
    ]
  }
}
